{
  "$schema": "https://json-schema.org/draft/2020-12/schema",
  "$id": "urn:mission-kit:schemas:entry-body:entry-body:v1alpha1",
  "title": "Catalogue entry body shape v1alpha1",
  "description": "Declares the ordered body sections an entry of a given category must carry. Frontmatter is governed by the catalogue entry contract; this governs everything below it. Held as one resource rather than one per category, because the concern is section conformance and splitting it would fork the mechanism.",
  "type": "object",
  "additionalProperties": false,
  "required": [
    "apiVersion",
    "kind",
    "metadata",
    "spec"
  ],
  "properties": {
    "apiVersion": {
      "const": "schemas.mission-kit/v1alpha1"
    },
    "kind": {
      "const": "EntryBody"
    },
    "metadata": {
      "$ref": "urn:mission-kit:schemas:common:resource-metadata:v1alpha1"
    },
    "spec": {
      "type": "object",
      "additionalProperties": false,
      "required": [
        "categories"
      ],
      "properties": {
        "categories": {
          "description": "One declaration per governed category. A category absent from this list is ungoverned, which is a stated gap rather than a silent one.",
          "type": "array",
          "minItems": 1,
          "items": {
            "type": "object",
            "additionalProperties": false,
            "required": [
              "category",
              "sections"
            ],
            "properties": {
              "category": {
                "description": "The catalogue category this shape governs. Matches the category field of the entries it applies to.",
                "type": "string",
                "enum": [
                  "axiom",
                  "entity",
                  "component",
                  "artifact",
                  "trait"
                ]
              },
              "rationale": {
                "description": "Why this shape, in one sentence. A shape with no stated reason is a convention that nobody can argue with.",
                "type": "string",
                "minLength": 1
              },
              "ordered": {
                "description": "Whether the sections must appear in the declared order. Order matters when the shape encodes a reading sequence, and does not when the sections are independent.",
                "type": "boolean",
                "default": true
              },
              "sections": {
                "description": "Required level-two headings, in the order they must appear. Exact text, without the leading marker.",
                "type": "array",
                "minItems": 1,
                "uniqueItems": true,
                "items": {
                  "type": "string",
                  "minLength": 1,
                  "pattern": "^[A-Z][^#\\n]*$"
                }
              },
              "exemptIds": {
                "description": "Entries of this category that the shape does not govern. The layer's composition entry defines the category rather than instantiating it, so it carries a different body. Declared rather than derived from the ID, because A0 follows the axiom shape genuinely and must stay governed.",
                "type": "array",
                "uniqueItems": true,
                "items": {
                  "type": "string",
                  "pattern": "^[A-Z]+-?[0-9]+$"
                }
              }
            }
          }
        },
        "charters": {
          "type": "object",
          "properties": {
            "rationale": {
              "type": "string"
            },
            "ordered": {
              "type": "boolean"
            },
            "sections": {
              "type": "array",
              "items": {
                "type": "string"
              },
              "minItems": 1
            },
            "exemptIds": {
              "type": "array",
              "items": {
                "type": "string"
              }
            }
          },
          "required": [
            "rationale",
            "sections"
          ],
          "additionalProperties": false
        }
      }
    }
  }
}
