{
  "apiVersion": "schemas.mission-kit/v1alpha1",
  "kind": "EntryBody",
  "metadata": {
    "name": "catalogue-body-shapes"
  },
  "spec": {
    "categories": [
      {
        "category": "axiom",
        "rationale": "An axiom states a limit and its consequences, so the reader needs the limit, how it is approached and held, why it is load-bearing, what breaks short of it or moving away from it, and how distance from it is observed.",
        "ordered": true,
        "sections": [
          "Mandate",
          "Mechanics",
          "Rationale",
          "Faults",
          "Success signals"
        ],
        "exemptIds": [
          "A0"
        ]
      },
      {
        "category": "entity",
        "rationale": "A definition is only usable if it also says what it excludes, so Boundaries is required rather than optional; a definition that only says what a thing is leaves every adjacent case undecided.",
        "ordered": true,
        "sections": [
          "Definition",
          "Discriminators",
          "Boundaries",
          "Relations",
          "Why precision matters"
        ],
        "exemptIds": [
          "E0"
        ]
      },
      {
        "category": "component",
        "rationale": "Closeness of fit must be judgeable without reading the implementation, which requires the duty, the contract and the fit criteria to be stated separately.",
        "ordered": true,
        "sections": [
          "Duty",
          "Contract",
          "Reference",
          "Fit criteria",
          "Adjustment policy",
          "Edges"
        ],
        "exemptIds": [
          "C0"
        ]
      },
      {
        "category": "artifact",
        "rationale": "A document type is instantiable only when its required sections and its acceptance condition are both stated, and acceptance must be an observation rather than prose about quality.",
        "ordered": true,
        "sections": [
          "Purpose",
          "Lifecycle stage",
          "Required sections",
          "Authority",
          "Acceptance falsifier",
          "Template"
        ],
        "exemptIds": [
          "AR0"
        ]
      },
      {
        "category": "trait",
        "rationale": "A trait decides whether axioms bind, so a reader must be able to apply it to their own system: it states what the characteristic is, an observable test, where its edges are, which axioms it brings into force, and why the obligation follows from the characteristic.",
        "ordered": true,
        "sections": [
          "Definition",
          "Test",
          "Boundaries",
          "Axioms it brings into force",
          "Why the obligation follows"
        ],
        "exemptIds": [
          "T0"
        ]
      }
    ],
    "charters": {
      "rationale": "A charter is a set's only voice, and a set with no charter is a directory listing. These sections are the questions a member cannot answer for itself: what the population covers, what admits one, what a healthy population looks like against a merely valid one, and where its members are. Everything else a charter says is that set's own substance and is deliberately unconstrained.",
      "ordered": false,
      "sections": [
        "Territory",
        "What earns an entry",
        "Faults",
        "Index"
      ],
      "exemptIds": []
    }
  }
}
